,message,label
1139,"Sad story of a Man - Last week was my b'day. My Wife did'nt wish me. My Parents forgot n so did my Kids . I went to work. Even my Colleagues did not wish. As I entered my cabin my PA said, '' Happy B'day Boss !!''. I felt special. She askd me 4 lunch. After lunch she invited me to her apartment. We went there. She said,'' do u mind if I go into the bedroom for a minute ? '' ''OK'', I sed in a sexy mood. She came out 5 minuts latr wid a cake...n My Wife, My Parents, My Kidz, My Friends n My Colleagues. All screaming.. SURPRISE !! and I was waiting on the sofa.. ... ..... ' NAKED...!",ham
1140,Depends on where u going lor.,ham
1141,Wife.how she knew the time of murder exactly,ham
1142,What Today-sunday..sunday is holiday..so no work..,ham
1143,Yo do you know anyone  &lt;#&gt;  or otherwise able to buy liquor? Our guy flaked and right now if we don't get a hold of somebody its just 4 loko all night,ham
1144,Or better still can you catch her and let ask her if she can sell  &lt;#&gt;  for me.,ham
1145,Do ü all wan 2 meet up n combine all the parts? How's da rest of da project going?,ham
1146,Omg it could snow here tonite!,ham
1147,Does cinema plus drink appeal tomo? * Is a fr thriller by director i like on at mac at 8.30.,ham
1148,Dude ive been seeing a lotta corvettes lately,ham
1149,Congrats! Nokia 3650 video camera phone is your Call 09066382422 Calls cost 150ppm Ave call 3mins vary from mobiles 16+ Close 300603 post BCM4284 Ldn WC1N3XX,spam
1150,Lol they were mad at first but then they woke up and gave in.,ham
1151,I will cme i want to go to hos 2morow. After that i wil cme. This what i got from her dear what to do. She didnt say any time,ham
1152,Do you want a new video handset? 750 anytime any network mins? Half Price Line Rental? Camcorder? Reply or call 08000930705 for delivery tomorrow,spam
1153,I need to come home and give you some good lovin...,ham
1154,Then ü come n pick me at 530 ar?,ham
1155,"This is the 2nd attempt to contract U, you have won this weeks top prize of either £1000 cash or £200 prize. Just call 09066361921",spam
1156,"That day ü say ü cut ur hair at paragon, is it called hair sense? Do ü noe how much is a hair cut? ",ham
1157,"Oh, my love, it's soooo good to hear from you. Omg I missed you so much today. I'm sorry your having problems with the provider but thank you for tming me",ham
1158,Sorry i'm not free...,ham
1159,U ned to convince him tht its not possible witot hurting his feeling its the main,ham
1160,You also didnt get na hi hi hi hi hi,ham
1161,Today iZ Yellow rose day. If u love my frndship give me 1 misscall &amp; send this to ur frndZ &amp; See how many miss calls u get. If u get 6missed U marry ur Lover.,ham
1162,I love you. You set my soul on fire. It is not just a spark. But it is a flame. A big rawring flame. XoXo,ham
1163,Do u noe how 2 send files between 2 computers?,ham
1164,I went to project centre,ham
1165,Sounds better than my evening im just doing my costume. Im not sure what time i finish tomorrow but i will txt you at the end.,ham
1166,Shall i get my pouch?,ham
1167,You have an important customer service announcement from PREMIER. Call FREEPHONE 0800 542 0578 now!,spam
1168,Think I could stop by in like an hour or so? My roommate's looking to stock up for a trip,ham
1169,2 laptop... I noe infra but too slow lar... I wan fast one,ham
1170,"Whats that coming over the hill..... Is it a monster! Hope you have a great day. Things r going fine here, busy though! ",ham
1171,1 I don't have her number and 2 its gonna be a massive pain in the ass and i'd rather not get involved if that's possible,ham
1172,I want to lick your pussy now...,ham
1173,"Mah b, I'll pick it up tomorrow",ham
1174,"Had the money issue weigh me down but thanks to you, I can breathe easier now. I.ll make sure you dont regret it. Thanks.",ham
1175,We tried to call you re your reply to our sms for a video mobile 750 mins UNLIMITED TEXT free camcorder Reply or call now 08000930705 Del Thurs,spam
1176,"Cool, I'll text you in a few",ham
1177,"I.ll always be there, even if its just in spirit. I.ll get a bb soon. Just trying to be sure i need it.",ham
1178,Pls help me tell Ashley that i cant find her number oh,ham
1179,"Haha... Where got so fast lose weight, thk muz go 4 a month den got effect... Gee,later we go aust put bk e weight.",ham
1180,Nope... C ü then...,ham
1181,"Someone has contacted our dating service and entered your phone becausethey fancy you! To find out who it is call from a landline 09058098002. PoBox1, W14RG 150p",spam
1182,"Thanks for your ringtone order, reference number X29. Your mobile will be charged 4.50. Should your tone not arrive please call customer services 09065989180",spam
1183,Had your mobile 11mths ? Update for FREE to Oranges latest colour camera mobiles & unlimited weekend calls. Call Mobile Upd8 on freefone 08000839402 or 2StopTx,spam
1184,Wait  &lt;#&gt;  min..,ham
1185,You are gorgeous! keep those pix cumming :) thank you!,ham
1186,i want to grasp your pretty booty :),ham
1187,"Motivate Behind every darkness, there is a shining light waiting for you to find it... Behind every best friend, there is always trust and love... BSLVYL",ham
1188,Ugh. Gotta drive back to sd from la. My butt is sore.,ham
1189,Do you know what Mallika Sherawat did yesterday? Find out now @  &lt;URL&gt;,ham
1190,"""Si.como no?!listened2the plaid album-quite gd&the new air1 which is hilarious-also boughtbraindancea comp.ofstuff on aphexs ;abel,u hav2hear it!c u sn xxxx""",ham
1191,MY NO. IN LUTON 0125698789 RING ME IF UR AROUND! H*,ham
1192,Lara said she can loan me  &lt;#&gt; .,ham
1193,"Hiya, sorry didn't hav signal. I haven't seen or heard from and neither has, which is unusual in itself! I'll put on the case and get him to sort it out! Hugs and snogs.",ham
1194,Oops i thk i dun haf enuff... I go check then tell ü..,ham
1195,WHAT TIME U WRKIN?,ham
1196,Ugh I don't wanna get out of bed. It's so warm.,ham
1197,RT-KIng Pro Video Club>> Need help? info@ringtoneking.co.uk or call 08701237397 You must be 16+ Club credits redeemable at www.ringtoneking.co.uk! Enjoy!,spam
1198,FREE MSG:We billed your mobile number by mistake from shortcode 83332.Please call 08081263000 to have charges refunded.This call will be free from a BT landline,spam
1199,You will go to walmart. I.ll stay.,ham
1200,Think + da. You wil do.,ham
1201,Send me your id and password,ham
1202,Well done and ! luv ya all ,ham
1203,Ok leave no need to ask,ham
1204,Here got ur favorite oyster... N got my favorite sashimi... Ok lar i dun say already... Wait ur stomach start rumbling...,ham
1205,Just finished. Missing you plenty,ham
1206,I have 2 docs appointments next week.:/ I'm tired of them shoving stuff up me. Ugh why couldn't I have had a normal body?,ham
1207,Aiyah e rain like quite big leh. If drizzling i can at least run home.,ham
1208,"Orange customer, you may now claim your FREE CAMERA PHONE upgrade for your loyalty. Call now on 0207 153 9996. Offer ends 14thMarch. T&C's apply. Opt-out availa",spam
1209,Yes! How is a pretty lady like you single?,ham
1210,IM FINE BABES AINT BEEN UP 2 MUCH THO! SAW SCARY MOVIE YEST ITS QUITE FUNNY! WANT 2MRW AFTERNOON? AT TOWN OR MALL OR SUMTHIN?xx,ham
1211,Haha... dont be angry with yourself... Take it as a practice for the real thing. =) ,ham
1212,I anything lor.,ham
1213,What you did in  leave.,ham
1214,What type of stuff do you sing?,ham
1215,Message from . I am at Truro Hospital on ext. You can phone me here. as I have a phone by my side,ham
1216,Urgent! Please call 09061213237 from landline. £5000 cash or a luxury 4* Canary Islands Holiday await collection. T&Cs SAE PO Box 177. M227XY. 150ppm. 16+,spam
1217,Anyway i'm going shopping on my own now. Cos my sis not done yet. Dun disturb u liao.,ham
1218,Ok. Very good. Its all about making that money.,ham
1219,"Mmmmm ... I loved waking to your words this morning ! I miss you too, my Love. I hope your day goes well and you are happy. I wait for us to be together again",ham
1220,Sen told that he is going to join his uncle finance in cbe,ham
1221,Nite...,ham
1222,"HOT LIVE FANTASIES call now 08707500020 Just 20p per min NTT Ltd, PO Box 1327 Croydon CR9 5WB 0870 is a national rate call",spam
1223,Ha... Both of us doing e same thing. But i got tv 2 watch. U can thk of where 2 go tonight or u already haf smth in mind...,ham
1224,Finish liao... U?,ham
1225,Wat makes u thk i'll fall down. But actually i thk i'm quite prone 2 falls. Lucky my dad at home i ask him come n fetch me already.,ham
1226,"A Boy loved a gal. He propsd bt she didnt mind. He gv lv lttrs, Bt her frnds threw thm. Again d boy decided 2 aproach d gal , dt time a truck was speeding towards d gal. Wn it was about 2 hit d girl,d boy ran like hell n saved her. She asked 'hw cn u run so fast?' D boy replied ""Boost is d secret of my energy"" n instantly d girl shouted ""our energy"" n Thy lived happily 2gthr drinking boost evrydy Moral of d story:- I hv free msgs:D;): gud ni8",ham
1227,Hi Petey!noim ok just wanted 2 chat coz avent spoken 2 u 4 a long time-hope ur doin alrite.have good nit at js love ya am.x,ham
1228,Wat's da model num of ur phone?,ham
1229,"""NOT ENUFCREDEIT TOCALL.SHALL ILEAVE UNI AT 6 +GET A BUS TO YOR HOUSE?""",ham
1230,"True. It is passable. And if you get a high score and apply for phd, you get 5years of salary. So it makes life easier.",ham
1231,Whatsup there. Dont u want to sleep,ham
1232,Just do what ever is easier for you,ham
1233,Ok...,ham
1234,No let me do the math. Your not good at it.,ham
1235,K.k:)i'm going to tirunelvali this week to see my uncle ..i already spend the amount by taking dress .so only i want money.i will give it on feb 1,ham
1236,Prepare to be pleasured :),ham
1237,Thinkin about someone is all good. No drugs for that,ham
1238,"Hurry up, I've been weed-deficient for like three days",ham
1239,K...k...when will you give treat?,ham
1240,Mum not going robinson already.,ham
1241,Yup bathe liao...,ham
1242, and  picking them up from various points,ham
1243,You will be in the place of that man,ham
1244,When should I come over?,ham
1245,Sorry to be a pain. Is it ok if we meet another night? I spent late afternoon in casualty and that means i haven't done any of y stuff42moro and that includes all my time sheets and that. Sorry. ,ham
1246,I am going to film 2day da. At 6pm. Sorry da.,ham
1247,"Fun fact: although you would think armand would eventually build up a tolerance or some shit considering how much he smokes, he gets fucked up in like 2 hits",ham
1248,"Dont give a monkeys wot they think and i certainly don't mind. Any friend of mine&all that! Just don't sleep wiv , that wud be annoyin!",ham
1249,He telling not to tell any one. If so treat for me hi hi hi,ham
1250,Loans for any purpose even if you have Bad Credit! Tenants Welcome. Call NoWorriesLoans.com on 08717111821,spam
1251,I'll reach in ard 20 mins ok...,ham
1252,Are you still getting the goods.,ham
1253,Don know:)this week i'm going to tirunelvai da.,ham
1254,"I haven't forgotten you, i might have a couple bucks to send you tomorrow, k? I love ya too",ham
1255,Water logging in desert. Geoenvironmental implications.,ham
1256,I'll text now! All creepy like so he won't think that we forgot,ham
1257,Dont put your phone on silent mode ok,ham
1258,"Thank you. And by the way, I just lost.",ham
1259,What r u cooking me for dinner?,ham
1260,Sorry . I will be able to get to you. See you in the morning.,ham
1261,"OH YEAH,AND HAV A GREAT TIME IN NEWQUAY-SEND ME A POSTCARD !1 LOOK AFTER ALL THE GIRLS WHILE IM GONE(U KNOW THE 1IM TALKIN BOUT!)xx",ham
1262,"""CHEERS U TEX MECAUSE U WEREBORED! YEAH OKDEN HUNNY R UIN WK SAT?SOUNDS LIKEYOUR HAVIN GR8FUN J! KEEP UPDAT COUNTINLOTS OF LOVEME XXXXX.""",ham
1263,NOT MUCH NO FIGHTS. IT WAS A GOOD NITE!!,ham
1264,When is school starting. Where will you stay. What's the weather like. And the food. Do you have a social support system like friends in the school. All these things are important.,ham
1265,Today is ACCEPT DAY..U Accept me as? Brother Sister Lover Dear1 Best1 Clos1 Lvblefrnd Jstfrnd Cutefrnd Lifpartnr Belovd Swtheart Bstfrnd No rply means enemy,ham
1266,No calls..messages..missed calls,ham
1267,I liked the new mobile,ham
1268,"tddnewsletter@emc1.co.uk (More games from TheDailyDraw) Dear Helen, Dozens of Free Games - with great prizesWith..",spam
1269,I'm in town now so i'll jus take mrt down later.,ham
1270,URGENT! Your Mobile number has been awarded a <UKP>2000 prize GUARANTEED. Call 09061790125 from landline. Claim 3030. Valid 12hrs only 150ppm,spam
1271,"Haven't seen my facebook, huh? Lol!",ham
1272,No. It's not pride. I'm almost  &lt;#&gt;  years old and shouldn't be takin money from my kid. You're not supposed to have to deal with this stuff. This is grownup stuff--why i don't tell you.,ham
1273,Today i'm not workin but not free oso... Gee... Thgt u workin at ur fren's shop ? ,ham
1274,Yup ok...,ham
1275,"You are being contacted by our dating service by someone you know! To find out who it is, call from a land line 09050000878. PoBox45W2TG150P",spam
1276,Nothin comes to my mind. Ü help me buy hanger lor. Ur laptop not heavy?,ham
1277,Host-based IDPS for linux systems.,ham
1278,"You know, wot people wear. T shirts, jumpers, hat, belt, is all we know. We r at Cribbs",ham
1279,Ok...,ham
1280,All e best 4 ur exam later.,ham
1281,"Sure, if I get an acknowledgement from you that it's astoundingly tactless and generally faggy to demand a blood oath fo",ham
1282,I thank you so much for all you do with selflessness. I love you plenty.,ham
1283,Yup i'm elaborating on the safety aspects and some other issues..,ham
1284,"I want to show you the world, princess :) how about europe?",ham
1285,"Aight, I should be there by 8 at the latest, probably closer to 7. Are jay and tyler down or should we just do two trips?",ham
1286,God bless.get good sleep my dear...i will pray!,ham
1287,Thk some of em find wtc too far... Weiyi not goin... E rest i dunno yet... R ur goin 4 dinner den i might b able to join...,ham
1288,"That's fine, have him give me a call if he knows what he wants or has any questions",ham
1289,Try to do something dear. You read something for exams,ham
1290,U 2.,ham
1291,They did't play one day last year know even though they have very good team.. Like india.,ham
1292,Is fujitsu s series lifebook good?,ham
1293,Lmao you know me so well...,ham
1294,"Yeah I should be able to, I'll text you when I'm ready to meet up",ham
1295,either way works for me. I am  &lt;#&gt;  years old. Hope that doesnt bother you.,ham
1296,"Say this slowly.? GOD,I LOVE YOU &amp; I NEED YOU,CLEAN MY HEART WITH YOUR BLOOD.Send this to Ten special people &amp; u c miracle tomorrow, do it,pls,pls do it...",ham
1297,Noooooooo please. Last thing I need is stress. For once in your life be fair.,ham
1298,K I'll take care of it,ham
1299,Watching ajith film ah?,ham
1300,"I just lov this line: ""Hurt me with the truth, I don't mind,i wil tolerat.bcs ur my someone..... But, Never comfort me with a lie"" gud ni8 and sweet dreams",ham
1301,I come n pick ü up... Come out immediately aft ur lesson...,ham
1302,"Sure thing big man. i have hockey elections at 6, shouldn‘t go on longer than an hour though",ham
1303,"0A$NETWORKS allow companies to bill for SMS, so they are responsible for their ""suppliers"", just as a shop has to give a guarantee on what they sell. B. G.",spam
1304,"Dear,Me at cherthala.in case u r coming cochin pls call bfore u start.i shall also reach accordingly.or tell me which day u r coming.tmorow i am engaged ans its holiday.",ham
1305,Think you sent the text to the home phone. That cant display texts. If you still want to send it his number is,ham
1306,"Double mins and txts 4 6months FREE Bluetooth on Orange. Available on Sony, Nokia Motorola phones. Call MobileUpd8 on 08000839402 or call2optout/N9DX",spam
1307,K..k:)how much does it cost?,ham
1308,You call times job today ok umma and ask them to speed up,ham
1309,Ok i msg u b4 i leave my house.,ham
1310,Ok lor then we go tog lor...,ham
1311,"K, wat s tht incident?",ham
1312,New car and house for my parents.:)i have only new job in hand:),ham
1313,Oh for fuck's sake she's in like tallahassee,ham
1314,Lovely smell on this bus and it ain't tobacco... ,ham
1315,Enjoy the jamster videosound gold club with your credits for 2 new videosounds+2 logos+musicnews! get more fun from jamster.co.uk! 16+only Help? call: 09701213186 ,spam
1316,wamma get laid?want real doggin locations sent direct to your mobile? join the UKs largest dogging network. txt dogs to 69696 now!nyt. ec2a. 3lp £1.50/msg.,spam
1317,Feel like trying kadeem again? :V,ham
1318,Yes.he have good crickiting mind,ham
1319,"Hiya , have u been paying money into my account? If so, thanks. Got a pleasant surprise when i checked my balance -u c, i don't get statements 4 that acc",ham
1320,cThen i thk shd b enuff.. Still got conclusion n contents pg n references.. I'll b doing da contents pg n cover pg..,ham
1321,K I'll call you when I'm close,ham
1322,Umma. Did she say anything,ham
1323,Daddy will take good care of you :),ham
1324,Why do you ask princess?,ham
1325,I keep ten rs in my shelf:) buy two egg.,ham
1326,"If you don't, your prize will go to another customer. T&C at www.t-c.biz 18+ 150p/min Polo Ltd Suite 373 London W1J 6HL Please call back if busy",spam
1327,Dunno lei he neva say...,ham
1328,Dunno leh cant remember mayb lor. So wat time r we meeting tmr?,ham
1329,Urgent! Please call 09061743811 from landline. Your ABTA complimentary 4* Tenerife Holiday or £5000 cash await collection SAE T&Cs Box 326 CW25WX 150ppm,spam
1330,Raji..pls do me a favour. Pls convey my Birthday wishes to Nimya. Pls. Today is her birthday.,ham
1331,Huh means computational science... Y they like dat one push here n there...,ham
1332,"""Hi darlin i cantdo anythingtomorrow as myparents aretaking me outfor a meal. when are u free? Katexxx""",ham
1333,RCT' THNQ Adrian for U text. Rgds Vatian,spam
1334,I meant middle left or right?,ham
1335,"Cool breeze... Bright sun... Fresh flower... Twittering birds... All these waiting to wish u: ""GOODMORNING &amp; HAVE A NICE DAY"" :)",ham
1336,I wan but too early lei... Me outside now wun b home so early... Neva mind then...,ham
1337,Ok u can take me shopping when u get paid =D,ham
1338,Well its not like you actually called someone a punto. That woulda been worse.,ham
1339,Are u awake? Is there snow there?,ham
1340,The Xmas story is peace.. The Xmas msg is love.. The Xmas miracle is jesus.. Hav a blessed month ahead &amp; wish U Merry Xmas...,ham
1341,"Hi. Wk been ok - on hols now! Yes on for a bit of a run. Forgot that i have hairdressers appointment at four so need to get home n shower beforehand. Does that cause prob for u?""",ham
1342,Check audrey's status right now,ham
1343,"Excellent, I'll see what riley's plans are",ham
1344,Hope you are having a good week. Just checking in,ham
1345,Do have a nice day today. I love you so dearly.,ham
1346,Old Orchard near univ. How about you?,ham
1347,Huh so early.. Then ü having dinner outside izzit?,ham
1348,Die... Now i have e toot fringe again...,ham
1349,Are you happy baby ? Are you alright ? Did you take that job ? I hope your fine. I send you a kiss to make you smile from across the sea ... *kiss* *kiss*,ham
1350,I've reached sch already...,ham
1351,"alright, I'll make sure the car is back tonight",ham
1352,"Hey, I missed you tm of last night as my phone was on the charge ... *smiles* ... I am meeting a friend shortly",ham
1353,Oh unintentionally not bad timing. Great. Fingers  the trains play along! Will give fifteen min warning.,ham
1354,Happy new year. Hope you are having a good semester,ham
1355,"Our dating service has been asked 2 contact U by someone shy! CALL 09058091870 NOW all will be revealed. POBox84, M26 3UZ 150p",spam
1356,JADE ITS PAUL. Y DIDNT U TXT ME? DO U REMEMBER ME FROM BARMED? I WANT 2 TALK 2 U! TXT ME,ham
1357,Haven't left yet so probably gonna be here til dinner,ham
1358,Tiwary to rcb.battle between bang and kochi.,ham
1359,hi baby im cruisin with my girl friend what r u up 2? give me a call in and hour at home if thats alright or fone me on this fone now love jenny xxx,ham
1360,That's y i said it's bad dat all e gals know u... Wat u doing now?,ham
1361,Cold. Dont be sad dear,ham
1362,No. But we'll do medical missions to nigeria,ham
1363,Where do you need to go to get it?,ham
1364,did u get that message,ham
1365,U definitely need a module from e humanities dis sem izzit? U wan 2 take other modules 1st?,ham
1366,You are a great role model. You are giving so much and i really wish each day for a miracle but God as a reason for everything and i must say i wish i knew why but i dont. I've looked up to you since i was young and i still do. Have a great day.,ham
1367,Probably money worries. Things are coming due and i have several outstanding invoices for work i did two and three months ago.,ham
1368,Your opinion about me? 1. Over 2. Jada 3. Kusruthi 4. Lovable 5. Silent 6. Spl character 7. Not matured 8. Stylish 9. Simple Pls reply..,ham
1369,Msg me when rajini comes.,ham
1370,"FR'NDSHIP is like a needle of a clock. Though V r in d same clock, V r nt able 2 met. Evn if V meet,itz only 4few seconds. Bt V alwys stay conected. Gud 9t;-)",ham
1371,Yes but can we meet in town cos will go to gep and then home. You could text at bus stop. And don't worry we'll have finished by march … ish!,ham
1372,Is that seriously how you spell his name?,ham
1373,"Urgh, coach hot, smells of chip fat! Thanks again, especially for the duvet (not a predictive text word).",ham
1374,"Oops I did have it,  &lt;#&gt; ?",ham
1375,My house here e sky quite dark liao... If raining then got excuse not 2 run already rite... Hee...,ham
1376,"Win the newest “Harry Potter and the Order of the Phoenix (Book 5) reply HARRY, answer 5 questions - chance to be the first among readers!",spam
1377,East coast,ham
1378,How much she payed. Suganya.,ham
1379,"What will we do in the shower, baby?",ham
1380,How are you doing? Hope you've settled in for the new school year. Just wishin you a gr8 day,ham
1381,"Hey chief, can you give me a bell when you get this. Need to talk to you about this royal visit on the 1st june. ",ham
1382,THING R GOOD THANX GOT EXAMS IN MARCH IVE DONE NO REVISION? IS FRAN STILL WITH BOYF? IVE GOTTA INTERVIW 4 EXETER BIT WORRIED!x,ham
1383,BIG BROTHER ALERT! The computer has selected u for 10k cash or #150 voucher. Call 09064018838. NTT PO Box CRO1327 18+ BT Landline Cost 150ppm mobiles vary,spam
1384,"We spend our days waiting for the ideal path to appear in front of us.. But what we forget is.. ""paths are made by walking.. not by waiting.."" Goodnight!",ham
1385,aathi..where are you dear..,ham
1386,Hey tmr meet at bugis 930 ?,ham
1387,i thought we were doing a king of the hill thing there.,ham
1388,I'm done...,ham
1389,Wif my family booking tour package.,ham
1390,"Do you ever notice that when you're driving, anyone going slower than you is an idiot and everyone driving faster than you is a maniac?",spam
1391,"Hey ! I want you ! I crave you ! I miss you ! I need you ! I love you, Ahmad Saeed al Hallaq ...",ham
1392,Ü still attending da talks?,ham
1393,&lt;#&gt;  great loxahatchee xmas tree burning update: you can totally see stars here,ham
1394,Also remember the beads don't come off. Ever.,ham
1395,Talk to g and x about that,ham
1396,How do friends help us in problems? They give the most stupid suggestion that Lands us into another problem and helps us forgt the previous problem,ham
1397,Did you show him and wot did he say or could u not c him 4 dust?,ham
1398,"K I'll head out in a few mins, see you there",ham
1399,"Sorry, I'll call later",ham
1400,Wishing you a wonderful week.,ham
1401,"TODAY is Sorry day.! If ever i was angry with you, if ever i misbehaved or hurt you? plz plz JUST SLAP URSELF Bcoz, Its ur fault, I'm basically GOOD",ham
1402,Thought we could go out for dinner. I'll treat you! Seem ok?,ham
1403,Did u got that persons story,ham
1404,Networking job is there.,ham
1405,K. I will sent it again,ham
1406,Urgent Please call 09066612661 from landline. £5000 cash or a luxury 4* Canary Islands Holiday await collection. T&Cs SAE award. 20M12AQ. 150ppm. 16+ “,spam
1407,PRIVATE! Your 2003 Account Statement for shows 800 un-redeemed S. I. M. points. Call 08715203694 Identifier Code: 40533 Expires 31/10/04,spam
1408,You have to pls make a note of all she.s exposed to. Also find out from her school if anyone else was vomiting. Is there a dog or cat in the house? Let me know later.,ham
1409,True dear..i sat to pray evening and felt so.so i sms'd you in some time...,ham
1410,"""Hey j! r u feeling any better, hopeSo hunny. i amnow feelin ill & ithink i may have tonsolitusaswell! damn iam layin in bedreal bored. lotsof luv me xxxx""",ham
1411,Hmm...Bad news...Hype park plaza $700 studio taken...Only left 2 bedrm-$900...,ham
1412,We're on the opposite side from where we dropped you off,ham
1413,I like to think there's always the possibility of being in a pub later.,ham
1414,If u laugh really loud.. If u talk spontaneously.. If u dont care what others feel.. U are probably with your dear &amp; best friends.. GOODEVENING Dear..:),ham
1415,Wat r u doing?,ham
1416,I keep ten rs in my shelf:) buy two egg.,ham
1417,Hai dear friends... This is my new &amp; present number..:) By Rajitha Raj (Ranju),ham
1418,Nobody can decide where to eat and dad wants Chinese,ham
1419,Hows the champ just leaving glasgow!,ham
1420,Exactly. Anyways how far. Is jide her to study or just visiting,ham
