,message,label
1977,This girl does not stay in bed. This girl doesn't need recovery time. Id rather pass out while having fun then be cooped up in bed,ham
1978,Crazy ar he's married. Ü like gd looking guys not me. My frens like say he's korean leona's fave but i dun thk he is. Aft some thinking mayb most prob i'll go.,ham
1979,K:)k:)good:)study well.,ham
1980,"Hey Boys. Want hot XXX pics sent direct 2 ur phone? Txt PORN to 69855, 24Hrs free and then just 50p per day. To stop text STOPBCM SF WC1N3XX",spam
1981,"Received, understood n acted upon!",ham
1982,"Nah man, my car is meant to be crammed full of people",ham
1983,I dont thnk its a wrong calling between us,ham
1984,"Better than bb. If he wont use it, his wife will or them doctor",ham
1985,"HEY THERE BABE, HOW U DOIN? WOT U UP 2 2NITE LOVE ANNIE X.",ham
1986,Sad story of a Man - Last week was my b'day. My Wife did'nt wish me. My Parents forgot n so did my Kids . I went to work. Even my Colleagues did not wish.,ham
1987,They released vday shirts and when u put it on it makes your bottom half naked instead of those white underwear.,ham
1988,December only! Had your mobile 11mths+? You are entitled to update to the latest colour camera mobile for Free! Call The Mobile Update Co FREE on 08002986906,spam
1989,Today is ACCEPT DAY..U Accept me as? Brother Sister Lover Dear1 Best1 Clos1 Lvblefrnd Jstfrnd Cutefrnd Lifpartnr Belovd Swtheart Bstfrnd No rply means enemy,ham
1990,Is there coming friday is leave for pongal?do you get any news from your work place.,ham
1991,No it's waiting in e car dat's bored wat. Cos wait outside got nothing 2 do. At home can do my stuff or watch tv wat.,ham
1992,XMAS Prize draws! We are trying to contact U. Todays draw shows that you have won a £2000 prize GUARANTEED. Call 09058094565 from land line. Valid 12hrs only,spam
1993,"Tell you what, if you make a little spreadsheet and track whose idea it was to smoke to determine who ""smokes too much"" for the entire month of february, I'll come up",ham
1994,If i said anything wrong sorry de:-),ham
1995,Dhoni have luck to win some big title.so we will win:),ham
1996,Should I tell my friend not to come round til like  &lt;#&gt; ish?,ham
1997,This phone has the weirdest auto correct.,ham
1998,IMPORTANT INFORMATION 4 ORANGE USER 0796XXXXXX. TODAY IS UR LUCKY DAY!2 FIND OUT WHY LOG ONTO http://www.urawinner.com THERE'S A FANTASTIC PRIZEAWAITING YOU!,spam
1999,"What are you doing in langport? Sorry, but I'll probably be in bed by 9pm. It sucks being ill at xmas! When do you and go2sri lanka? ",ham
2000,K..k..any special today?,ham
2001,I am hot n horny and willing I live local to you - text a reply to hear strt back from me 150p per msg Netcollex LtdHelpDesk: 02085076972 reply Stop to end,spam
2002,Oh ok.. Wat's ur email?,ham
2003,"URGENT! You have won a 1 week FREE membership in our £100,000 Prize Jackpot! Txt the word: CLAIM to No: 81010 T&C www.dbuk.net LCCLTD POBOX 4403LDNW1A7RW18",spam
2004,I wnt to buy a BMW car urgently..its vry urgent.but hv a shortage of  &lt;#&gt; Lacs.there is no source to arng dis amt. &lt;#&gt; lacs..thats my prob,ham
2005,I donno if they are scorable,ham
2006,Am I the only one who doesn't stalk profiles?,ham
2007,Do you want a new Video handset? 750 any time any network mins? UNLIMITED TEXT? Camcorder? Reply or Call now 08000930705 for del Sat AM,spam
2008,"Alright omw, gotta change my order to a half8th",ham
2009,He needs to stop going to bed and make with the fucking dealing,ham
2010,"500 New Mobiles from 2004, MUST GO! Txt: NOKIA to No: 89545 & collect yours today!From ONLY £1 www.4-tc.biz 2optout 087187262701.50gbp/mtmsg18",spam
2011,This message is brought to you by GMW Ltd. and is not connected to the,spam
2012,"Haven't found a way to get another app for your phone, eh ? Will you go to the net cafe ? Did you take that job? Geeee I need you babe. I crave to see you ...",ham
2013,"""EY! CALM DOWNON THEACUSATIONS.. ITXT U COS IWANA KNOW WOTU R DOIN AT THEW/END... HAVENTCN U IN AGES..RING ME IF UR UP4 NETHING SAT.LOVE J XXX.""",ham
2014,Pls tell nelson that the bb's are no longer comin. The money i was expecting aint coming,ham
2015,The world's most happiest frnds never have the same characters... Dey just have the best understanding of their differences...,ham
2016,Huh but i got lesson at 4 lei n i was thinkin of going to sch earlier n i tot of parkin at kent vale...  ,ham
2017,Good Morning my Dear........... Have a great &amp; successful day.,ham
2018,"hey, looks like I was wrong and one of the kappa guys numbers is still on my phone, if you want I can text him and see if he's around",ham
2019,In xam hall boy asked girl Tell me the starting term for dis answer I can den manage on my own After lot of hesitation n lookin around silently she said THE! intha ponnungale ipaditan;),ham
2020,Yup ok...,ham
2021,1's reach home call me.,ham
2022,"If you're still up, maybe leave the credit card so I can get gas when I get back like he told me to",ham
2023,"Al he does is moan at me if n e thin goes wrong its my fault&al de arguments r my fault&fed up of him of himso y bother? Hav 2go, thanx.xx",ham
2024,Filthy stories and GIRLS waiting for your,spam
2025,Hi 07734396839 IBH Customer Loyalty Offer: The NEW NOKIA6600 Mobile from ONLY £10 at TXTAUCTION!Txt word:START to No:81151 & get Yours Now!4T&,spam
2026,I will once i get home,ham
2027,K k:) sms chat with me.,ham
2028,K...k:)why cant you come here and search job:),ham
2029,"It's wylie, you in tampa or sarasota?",ham
2030,Yes baby! We can study all the positions of the kama sutra ;),ham
2031,I'm at home n ready...,ham
2032,"Geeee ... I miss you already, you know ? Your all I can think about. Fuck, I can't wait till next year when we will be together ... *loving kiss*",ham
2033,Those cocksuckers. If it makes you feel better ipads are worthless garbage novelty items and you should feel bad for even wanting one,ham
2034,All sounds good. Fingers . Makes it difficult to type,ham
2035,Just sent it. So what type of food do you like?,ham
2036,Lol I have to take it. member how I said my aunt flow didn't visit for 6 months? It's cause I developed ovarian cysts. Bc is the only way to shrink them.,ham
2037,"Sorry, went to bed early, nightnight",ham
2038,"I jus hope its true that  missin me cos i'm really missin him! You haven't done anything to feel guilty about, yet.",ham
2039,"Carlos is down but I have to pick it up from him, so I'll swing by usf in a little bit",ham
2040,Message:some text missing* Sender:Name Missing* *Number Missing *Sent:Date missing *Missing U a lot thats y everything is missing sent via fullonsms.com,ham
2041,Oh ok i didnt know what you meant. Yep i am baby jontin,ham
2042,What time you think you'll have it? Need to know when I should be near campus,ham
2043,Ok then u tell me wat time u coming later lor.,ham
2044,Hi mom we might be back later than  &lt;#&gt; ,ham
2045,No. Did you multimedia message them or e-mail?,ham
2046,WIN URGENT! Your mobile number has been awarded with a £2000 prize GUARANTEED call 09061790121 from land line. claim 3030 valid 12hrs only 150ppm ,spam
2047,Urgent! Please call 09061213237 from a landline. £5000 cash or a 4* holiday await collection. T &Cs SAE PO Box 177 M227XY. 16+,spam
2048,My uncles in Atlanta. Wish you guys a great semester.,ham
2049,I havent add ü yet right.. ,ham
2050,I wud never mind if u dont miss me or if u dont need me.. But u wil really hurt me wen u need me &amp; u dont tell me......... Take care:-),ham
2051,My sister going to earn more than me da.,ham
2052,"Win the newest Harry Potter and the Order of the Phoenix (Book 5) reply HARRY, answer 5 questions - chance to be the first among readers!",spam
2053,* Am on a train back from northampton so i'm afraid not!,ham
2054,"see, i knew giving you a break a few times woul lead to you always wanting to miss curfew. I was gonna gibe you 'til one, but a MIDNIGHT movie is not gonna get out til after 2. You need to come home. You need to getsleep and, if anything, you need to b studdying ear training.",ham
2055,"Yeah, where's your class at?",ham
2056,Can i get your opinion on something first?,ham
2057,S...from the training manual it show there is no tech process:)its all about password reset and troubleshooting:),ham
2058,Its a great day. Do have yourself a beautiful one.,ham
2059,Gud ni8 dear..slp well..take care..swt dreams..Muah..,ham
2060,"Sorry man, accidentally left my phone on silent last night and didn't check it til I got up",ham
2061,Thank you. I like you as well...,ham
2062,"I'm nt goin, got somethin on, unless they meetin 4 dinner lor... Haha, i wonder who will go tis time...",ham
2063,"Gal n boy walking in d park. gal-can i hold ur hand? boy-y? do u think i would run away? gal-no, jst wana c how it feels walking in heaven with an prince..GN:-)",ham
2064,"Hi Chikku, send some nice msgs",ham
2065,What can i do? Might accidant tookplace between somewhere ghodbandar rd. Traffic moves slovely. So plz slip &amp; don't worry.,ham
2066,FREE for 1st week! No1 Nokia tone 4 ur mob every week just txt NOKIA to 8007 Get txting and tell ur mates www.getzed.co.uk POBox 36504 W45WQ norm150p/tone 16+,spam
2067,"Yes obviously, but you are the eggs-pert and the potato head… Speak soon! ",ham
2068,I'm going out to buy mum's present ar.,ham
2069,No wonder... Cos i dun rem seeing a silver car... But i thk i saw a black one...,ham
2070,I'm at work. Please call,ham
2071,Great! I hope you like your man well endowed. I am  &lt;#&gt;  inches...,ham
2072,Am slow in using biola's fne,ham
2073,"Faith makes things possible,Hope makes things work,Love makes things beautiful,May you have all three this Christmas!Merry Christmas!",ham
2074,No my mum went 2 dentist.,ham
2075,Noice. Text me when you're here,ham
2076,Bought one ringtone and now getting texts costing 3 pound offering more tones etc,spam
2077,Get a FREE mobile video player FREE movie. To collect text GO to 89105. Its free! Extra films can be ordered t's and c's apply. 18 yrs only,spam
2078,IM GONNA MISS U SO MUCH,ham
2079,Now got tv 2 watch meh? U no work today?,ham
2080,Ambrith..madurai..met u in arun dha marrge..remembr?,ham
2081,Not getting anywhere with this damn job hunting over here!,ham
2082,Not a lot has happened here. Feels very quiet. Beth is at her aunts and charlie is working lots. Just me and helen in at the mo. How have you been? ,ham
2083,So u wan 2 come for our dinner tonight a not?,ham
2084,"Also sir, i sent you an email about how to log into the usc payment portal. I.ll send you another message that should explain how things are back home. Have a great weekend.",ham
2085,You are right though. I can't give you the space you want and need. This is really starting to become an issue. I was going to suggest setting a definite move out--if i'm still there-- after greece. But maybe you are ready and should do it now.,ham
2086,Ok... C ya...,ham
2087,By monday next week. Give me the full gist,ham
2088,.Please charge my mobile when you get up in morning.,ham
2089,Whens your radio show?,ham
2090,G wants to know where the fuck you are,ham
2091,Cuz ibored. And don wanna study,ham
2092,When are you going to ride your bike?,ham
2093,HI DARLIN ITS KATE ARE U UP FOR DOIN SOMETHIN TONIGHT? IM GOING TO A PUB CALLED THE SWAN OR SOMETHING WITH MY PARENTS FOR ONE DRINK SO PHONE ME IF U CAN,ham
2094,"Come around  &lt;DECIMAL&gt; pm vikky..i'm otside nw, il come by tht time",ham
2095,Pls send me your address sir.,ham
2096,Great! I shoot big loads so get ready!,ham
2097,Eh u send wrongly lar...,ham
2098,Hey u still at the gym?,ham
2099,"Good FRIENDS CaRE for each Other.. CLoSE Friends UNDERSTaND each Other... and TRUE Friends STaY forever beyond words, beyond time. Gud ni8",ham
2100,"It's fine, imma get a drink or somethin. Want me to come find you?",ham
2101,"YOU VE WON! Your 4* Costa Del Sol Holiday or £5000 await collection. Call 09050090044 Now toClaim. SAE, TC s, POBox334, Stockport, SK38xh, Cost£1.50/pm, Max10mins",spam
2102,Please CALL 08712402972 immediately as there is an urgent message waiting for you,spam
2103,"* Was a nice day and, impressively, i was sensible, went home early and now feel fine. Or am i just boring?! When's yours, i can't remember.",ham
2104,22 days to kick off! For Euro2004 U will be kept up to date with the latest news and results daily. To be removed send GET TXT STOP to 83222,spam
2105,"Do whatever you want. You know what the rules are. We had a talk earlier this week about what had to start happening, you showing responsibility. Yet, every week it's can i bend the rule this way? What about that way? Do whatever. I'm tired of having thia same argument with you every week. And a  &lt;#&gt;  movie DOESNT inlude the previews. You're still getting in after 1.",ham
2106,"Wen ur lovable bcums angry wid u, dnt take it seriously.. Coz being angry is d most childish n true way of showing deep affection, care n luv!.. kettoda manda... Have nice day da.",ham
2107,Y bishan lei... I tot ü say lavender? ,ham
2108,I'm wif him now buying tix lar...,ham
2109,Then ur physics get a-?,ham
2110,"Sorry vikky, i'm Watching olave mandara movie kano in trishul theatre wit my frnds..",ham
2111,CDs 4u: Congratulations ur awarded £500 of CD gift vouchers or £125 gift guaranteed & Freeentry 2 £100 wkly draw xt MUSIC to 87066 TnCs www.ldew.com1win150ppmx3age16 ,spam
2112,Thanks for your subscription to Ringtone UK your mobile will be charged £5/month Please confirm by replying YES or NO. If you reply NO you will not be charged,spam
2113,I'm in chennai velachery:),ham
2114,Dude got a haircut. Now its breezy up there,ham
2115,FreeMsg:Feelin kinda lnly hope u like 2 keep me company! Jst got a cam moby wanna c my pic?Txt or reply DATE to 82242 Msg150p 2rcv Hlp 08712317606 stop to 82242,spam
2116,Call Germany for only 1 pence per minute! Call from a fixed line via access number 0844 861 85 85. No prepayment. Direct access!,spam
2117,"Ahhhh...just woken up!had a bad dream about u tho,so i dont like u right now :) i didnt know anything about comedy night but i guess im up for it.",ham
2118,Dis is yijue. I jus saw ur mail. In case huiming havent sent u my num. Dis is my num.,ham
2119,Ok good then i later come find ü... C lucky i told ü to go earlier... Later pple take finish ü no more again...,ham
2120,"Japanese Proverb: If one Can do it, U too Can do it, If none Can do it,U must do it Indian version: If one Can do it, LET HIM DO it.. If none Can do it,LEAVE it!! And finally Kerala version: If one can do it, Stop him doing it.. If none can do it, Make a strike against it ...",ham
2121,"Ya ok, then had dinner?",ham
2122,"And that is the problem. You walk around in ""julianaland"" oblivious to what is going on around you. I say the same things constantly and they go in one ear and out the other while you go off doing whatever you want to do. It's not that you don't know why I'm upset--it's that you don't listen when i tell you WHAT is going to upset me. Then you want to be surprised when I'm mad.",ham
2123,"So anyways, you can just go to your gym or whatever, my love *smiles* I hope your ok and having a good day babe ... I miss you so much already",ham
2124,Lol! U drunkard! Just doing my hair at d moment. Yeah still up 4 tonight. Wats the plan? ,ham
2125,Ok no prob. Take ur time.,ham
2126,Monthly password for wap. mobsi.com is 391784. Use your wap phone not PC.,spam
2127,Did u turn on the heater? The heater was on and set to &lt;#&gt; degrees.,ham
2128,U have won a nokia 6230 plus a free digital camera. This is what u get when u win our FREE auction. To take part send NOKIA to 83383 now. POBOX114/14TCR/W1 16,spam
2129,Future is not what we planned for tomorrow.....! it is the result of what we do today...! Do the best in present... enjoy the future.,ham
2130,I cant pick the phone right now. Pls send a message,ham
2131,"Congrats! 2 mobile 3G Videophones R yours. call 09061744553 now! videochat wid ur mates, play java games, Dload polyH music, noline rentl. bx420. ip4. 5we. 150pm",spam
2132,It's é only $140 ard...É rest all ard $180 at least...Which is é price 4 é 2 bedrm ($900),ham
2133,I will be gentle baby! Soon you will be taking all  &lt;#&gt;  inches deep inside your tight pussy...,ham
2134,"Sorry pa, i dont knw who ru pa?",ham
2135,Studying. But i.ll be free next weekend.,ham
2136,Nice.nice.how is it working?,ham
2137,Customer place i will call you,ham
2138,"Sorry light turned green, I meant another friend wanted  &lt;#&gt;  worth but he may not be around",ham
2139,Big brother‘s really scraped the barrel with this shower of social misfits,ham
2140,Miserable. They don't tell u that the side effects of birth control are massive gut wrenching cramps for the first 2 months. I didn't sleep at all last night.,ham
2141,Yesterday its with me only . Now am going home.,ham
2142,Do you know when the result.,ham
2143,I have had two more letters from . I will copy them for you cos one has a message for you. Speak soon,ham
2144,U gd lor go shopping i got stuff to do. U wan 2 watch infernal affairs a not? Come lar...,ham
2145,Sad story of a Man - Last week was my b'day. My Wife did'nt wish me. My Parents forgot n so did my Kids . I went to work. Even my Colleagues did not wish.,ham
2146,Arun can u transfr me d amt,ham
2147,U calling me right? Call my hand phone...,ham
2148,"The guy (kadeem) hasn't been selling since the break, I know one other guy but he's paranoid as fuck and doesn't like selling without me there and I can't be up there til late tonight",ham
2149,"""Getting tickets 4 walsall tue 6 th march. My mate is getting me them on sat. ill pay my treat. Want 2 go. Txt bak .Terry""",ham
2150,Sorry that was my uncle. I.ll keep in touch,ham
2151,You're right I have now that I think about it,ham
2152,"Sorry about earlier. Putting out fires.Are you around to talk after 9? Or do you actually have a life, lol!",ham
2153,Hope ur head doesn't hurt 2 much ! Am ploughing my way through a pile of ironing ! Staying in with a chinky tonight come round if you like.,ham
2154,Hi im having the most relaxing time ever! we have to get up at 7am every day! was the party good the other night? I get home tomorrow at 5ish.,ham
2155,Dear U've been invited to XCHAT. This is our final attempt to contact u! Txt CHAT to 86688 150p/MsgrcvdHG/Suite342/2Lands/Row/W1J6HL LDN 18 yrs,spam
2156,Ya very nice. . .be ready on thursday,ham
2157,"I'm back, lemme know when you're ready",ham
2158,I sent lanre fakeye's Eckankar details to the mail box,ham
2159,Yes i will be there. Glad you made it.,ham
2160,Honey boo I'm missing u.,ham
2161,Yes..he is really great..bhaji told kallis best cricketer after sachin in world:).very tough to get out.,ham
2162,I thk 530 lor. But dunno can get tickets a not. Wat u doing now?,ham
2163,"Hey sweet, I was wondering when you had a moment if you might come to me ? I want to send a file to someone but it won't go over yahoo for them because their connection sucks, remember when you set up that page for me to go to and download the format disc ? Could you tell me how to do that ? Or do you know some other way to download big files ? Because they can download stuff directly from the internet. Any help would be great, my prey ... *teasing kiss*",ham
2164,Normally i use to drink more water daily:),ham
2165,S'fine. Anytime. All the best with it.,ham
2166,Still i have not checked it da. . .,ham
2167,"Living is very simple.. Loving is also simple.. Laughing is too simple.. Winning is tooo simple.. But, Being 'SIMPLE' is very difficult...;-) :-)",ham
2168,Also are you bringing galileo or dobby,ham
2169,Ü still got lessons?  Ü in sch?,ham
2170,"FREE GAME. Get Rayman Golf 4 FREE from the O2 Games Arcade. 1st get UR games settings. Reply POST, then save & activ8. Press 0 key for Arcade. Termsapply",spam
2171,You are awarded a SiPix Digital Camera! call 09061221061 from landline. Delivery within 28days. T Cs Box177. M221BP. 2yr warranty. 150ppm. 16 . p p£3.99,spam
2172,Howz that persons story,ham
2173,It's justbeen overa week since we broke up and already our brains are going to mush!,ham
2174,"Great. I'm in church now, will holla when i get out",ham
2175,For The First Time In The History 'Need' 'Comfort' And 'Luxury' Are Sold At Same Price In India..!! Onion-Rs. &lt;#&gt;  Petrol-Rs. &lt;#&gt;  Beer-Rs. &lt;#&gt;  SHESIL  &lt;#&gt;,ham
2176,Ok i am on the way to home hi hi,ham
2177,What's happening with you. Have you gotten a job and have you begun registration for permanent residency,ham
2178,No. She's currently in scotland for that.,ham
2179,"Sorry, I'll call later",ham
2180,"Its good, we'll find a way",ham
2181,"Kate jackson rec center before 7ish, right?",ham
2182,"She said,'' do u mind if I go into the bedroom for a minute ? '' ''OK'', I sed in a sexy mood. She came out 5 minuts latr wid a cake...n My Wife,",ham
2183,Ha ha - had popped down to the loo when you hello-ed me. Hello!,ham
2184,Thanx...,ham
2185,T-Mobile customer you may now claim your FREE CAMERA PHONE upgrade & a pay & go sim card for your loyalty. Call on 0845 021 3680.Offer ends 28thFeb.T&C's apply,spam
2186,U sick still can go shopping?,ham
2187,Thanks  and ! Or bomb and date as my phone wanted to say! ,ham
2188,U still painting ur wall?,ham
2189,Jos ask if u wana meet up?,ham
2190,Yes but I don't care cause I know its there!,ham
2191,HAPPY NEW YEAR MY NO.1 MAN,ham
2192,"I sent you the prices and do you mean the  &lt;#&gt; g,",ham
2193,"Haha yeah I see that now, be there in a sec",ham
2194,"This weeks SavaMob member offers are now accessible. Just call 08709501522 for details! SavaMob, POBOX 139, LA3 2WU. Only £1.50/week. SavaMob - offers mobile!",spam
2195,God created gap btwn ur fingers so dat sum1 vry special will fill those gaps by holding ur hands.. Now plz dont ask y he created so much gap between legs !!!,ham
2196,Ü ready then call me...,ham
2197,Only saturday and sunday holiday so its very difficult:),ham
2198,Babe ? I lost you ... Will you try rebooting ?,ham
2199,UR GOING 2 BAHAMAS! CallFREEFONE 08081560665 and speak to a live operator to claim either Bahamas cruise of£2000 CASH 18+only. To opt out txt X to 07786200117,spam
2200,Have you seen who's back at Holby?!,ham
2201,Are you planning to come chennai?,ham
2202,Prof: you have passed in all the papers in this sem congrats . . . . Student: Enna kalaachutaarama..!! Prof:???? Gud mrng!,ham
2203,URGENT This is our 2nd attempt to contact U. Your £900 prize from YESTERDAY is still awaiting collection. To claim CALL NOW 09061702893. ACL03530150PM,spam
2204,Me too! Have a lovely night xxx,ham
2205,I love to cuddle! I want to hold you in my strong arms right now...,ham
2206,I AM AT THE GAS STATION. GO THERE.,ham
2207,"No dice, art class 6 thru 9 :( thanks though. Any idea what time I should come tomorrow?",ham
2208,I've told him that i've returned it. That should i re order it.,ham
2209,So its to be poking man everyday that they teach you in canada abi! How are you. Just saying hi.,ham
2210,Eh u remember how 2 spell his name... Yes i did. He v naughty make until i v wet.,ham
2211,Ladies first and genus second k .,ham
2212,We are pleased to inform that your application for Airtel Broadband is processed successfully. Your installation will happen within 3 days.,ham
2213,Not a drop in the tank,ham
2214,Understand. his loss is my gain :) so do you work? School?,ham
2215,Looks like u wil b getting a headstart im leaving here bout 2.30ish but if u r desperate for my company I could head in earlier-we were goin to meet in rummer.,ham
2216,Do you always celebrate NY's with your family ?,ham
2217,todays vodafone numbers ending with 0089(my last four digits) are selected to received a £350 award. If your number matches please call 09063442151 to claim your £350 award,spam
2218,Jus telling u dat i'll b leaving 4 shanghai on 21st instead so we'll haf more time 2 meet up cya...,ham
2219,Oh k:)after that placement there ah?,ham
2220,Are you still playing with gautham?,ham
2221,"Evry Emotion dsn't hav Words.Evry Wish dsn't hav Prayrs.. If u Smile,D World is wit u.Othrwise even d Drop of Tear dsn't lik 2 Stay wit u.So b happy.. Good morning, keep smiling:-)",ham
2222,U have a Secret Admirer who is looking 2 make contact with U-find out who they R*reveal who thinks UR so special-call on 09065171142-stopsms-08718727870150ppm,spam
2223,"Aight, I'll ask a few of my roommates",ham
2224,Ok... Help me ask if she's working tmr a not?,ham
2225,"Yeah, probably here for a while",ham
2226,Hi my email address has changed now it is ,ham
2227,Senthil group company Apnt 5pm.,ham
2228,Ok lor. I ned 2 go toa payoh 4 a while 2 return smth u wan 2 send me there or wat?,ham
2229,Shopping lor. Them raining mah hard 2 leave orchard.,ham
2230,Hi. Customer Loyalty Offer:The NEW Nokia6650 Mobile from ONLY £10 at TXTAUCTION! Txt word: START to No: 81151 & get yours Now! 4T&Ctxt TC 150p/MTmsg,spam
2231,Just wanted to say holy shit you guys weren't kidding about this bud,ham
2232,YOU HAVE WON! As a valued Vodafone customer our computer has picked YOU to win a £150 prize. To collect is easy. Just call 09061743386 ,spam
2233,on hen night. Going with a swing,ham
2234,Forgot to tell ü smth.. Can ü like number the sections so that it's clearer..,ham
2235,Lol no ouch but wish i'd stayed out a bit longer,ham
2236,I place all ur points on e cultures module already.,ham
2237,"My sister in law, hope you are having a great month. Just saying hey. Abiola",ham
2238,FREE for 1st week! No1 Nokia tone 4 ur mobile every week just txt NOKIA to 8077 Get txting and tell ur mates. www.getzed.co.uk POBox 36504 W45WQ 16+ norm150p/tone,spam
2239,Pls confirm the time to collect the cheque.,ham
