,message,label
2818,I remain unconvinced that this isn't an elaborate test of my willpower,ham
2819,"Nah, Wednesday. When should I bring the mini cheetos bag over?",ham
2820,Its like that hotel dusk game i think. You solve puzzles in a area thing,ham
2821,Horrible gal. Me in sch doing some stuff. How come u got mc?,ham
2822,"Sorry chikku, my cell got some problem thts y i was nt able to reply u or msg u..",ham
2823,U should make a fb list,ham
2824,"I am late,so call you tomorrow morning.take care sweet dreams....u and me...ummifying...bye.",ham
2825,Meet after lunch la...,ham
2826,Surely result will offer:),ham
2827,"No my blankets are sufficient, thx",ham
2828,"FREE NOKIA Or Motorola with upto 12mths 1/2price linerental, 500 FREE x-net mins&100txt/mth FREE B'tooth*. Call Mobileupd8 on 08001950382 or call 2optout/D3WV",spam
2829,I wont touch you with out your permission.,ham
2830,"""Hello-/@drivby-:0quit edrunk sorry iff pthis makes no senrd-dnot no how ^ dancce 2 drum n basq!ihave fun 2nhite x ros xxxxxxx""",ham
2831,"Okay, good, no problem, and thanx!",ham
2832,How much i gave to you. Morning.,ham
2833,Love that holiday Monday feeling even if I have to go to the dentists in an hour,ham
2834,I wanted to wish you a Happy New Year and I wanted to talk to you about some legal advice to do with when Gary and I split but in person. I'll make a trip to Ptbo for that. I hope everything is good with you babe and I love ya :),ham
2835,Love it! Daddy will make you scream with pleasure! I am going to slap your ass with my dick!,ham
2836,FreeMsg: Fancy a flirt? Reply DATE now & join the UKs fastest growing mobile dating service. Msgs rcvd just 25p to optout txt stop to 83021. Reply DATE now!,spam
2837,Tell my  bad character which u Dnt lik in me. I'll try to change in  &lt;#&gt; . I ll add tat 2 my new year resolution. Waiting for ur reply.Be frank...good morning.,ham
2838,"Damn, can you make it tonight or do you want to just wait til tomorrow",ham
2839,That was random saw my old roomate on campus. He graduated,ham
2840,Hi :)finally i completed the course:),ham
2841,Dear umma she called me now :-),ham
2842,Maybe?! Say hi to  and find out if  got his card. Great escape or wetherspoons? ,ham
2843,How's it going? Got any exciting karaoke type activities planned? I'm debating whether to play football this eve. Feeling lazy though.,ham
2844,"Wait, do you know if wesleys in town? I bet she does hella drugs!",ham
2845,Call to the number which is available in appointment. And ask to connect the call to waheed fathima.,ham
2846,"Ok da, i already planned. I wil pick you.",ham
2847, gonna let me know cos comes bak from holiday that day.  is coming. Don't4get2text me  number. ,ham
2848,No rushing. I'm not working. I'm in school so if we rush we go hungry.,ham
2849,Okie...,ham
2850,hows my favourite person today? r u workin hard? couldn't sleep again last nite nearly rang u at 4.30,ham
2851,"Goodmorning,my grandfather expired..so am on leave today.",ham
2852,Yes. I come to nyc for audiitions and am trying to relocate.,ham
2853,thanks for the temales it was wonderful. Thank. Have a great week.,ham
2854,"GOD ASKED, ""What is forgiveness?"" A little child gave lovely reply, ""It is d wonderful fruit that a tree gives when it is being hurt by a stone.. Good night......",ham
2855,Congratulations ur awarded 500 of CD vouchers or 125gift guaranteed & Free entry 2 100 wkly draw txt MUSIC to 87066,spam
2856,Am i that much dirty fellow?,ham
2857,Sorry dude. Dont know how i forgot. Even after Dan reminded me. Sorry. Hope you guys had fun.,ham
2858,Now am free call me pa.,ham
2859,Gud mrng dear hav a nice day,ham
2860,Send this to ur friends and receive something about ur voice..... How is my speaking expression? 1.childish 2.naughty 3.Sentiment 4.rowdy 5.ful of attitude 6.romantic 7.shy 8.Attractive 9.funny  &lt;#&gt; .irritating  &lt;#&gt; .lovable. reply me..,ham
2861,Its worse if if uses half way then stops. Its better for him to complete it.,ham
2862,i can call in  &lt;#&gt;  min if thats ok,ham
2863,"The LAY MAN! Just to let you know you are missed and thought off. Do have a great day. And if you can send me bimbo and ugo's numbers, ill appreciate. Safe",ham
2864,U coming 2 pick me?,ham
2865,"So many people seems to be special at first sight, But only very few will remain special to you till your last sight.. Maintain them till life ends.. Sh!jas",ham
2866,"Call me. I m unable to cal. Lets meet bhaskar, and deep",ham
2867,Hey sexy buns! What of that day? No word from you this morning on YM ... :-( ... I think of you,ham
2868,Oh god. I'm gonna Google nearby cliffs now.,ham
2869,Goodmorning today i am late for  &lt;DECIMAL&gt; min.,ham
2870,Ur cash-balance is currently 500 pounds - to maximize ur cash-in now send GO to 86688 only 150p/meg. CC: 08718720201 HG/Suite342/2lands Row/W1j6HL,spam
2871,Went to ganesh dress shop,ham
2872,I will reach office around  &lt;DECIMAL&gt; . &amp; my mobile have problem. You cann't get my voice. So call you asa i'll free,ham
2873,We not watching movie already. Xy wants 2 shop so i'm shopping w her now.,ham
2874,Please call our customer service representative on FREEPHONE 0808 145 4742 between 9am-11pm as you have WON a guaranteed £1000 cash or £5000 prize!,spam
2875,If you are not coughing then its nothing,ham
2876,Apo all other are mokka players only,ham
2877,Shall i send that exe to your mail id.,ham
2878,Ok... Ur typical reply...,ham
2879,How much would it cost to hire a hitman,ham
2880,"K, if u bored up just come to my home..",ham
2881,In that case I guess I'll see you at campus lodge,ham
2882,"Goodmorning, today i am late for 1hr.",ham
2883,Nope but i'll b going 2 sch on fri quite early lor cos mys sis got paper in da morn :-),ham
2884,"Yes, princess. Are you going to make me moan?",ham
2885,Congrats. That's great. I wanted to tell you not to tell me your score cos it might make me relax. But its motivating me so thanks for sharing,ham
2886,Ok. There may be a free gym about.,ham
2887,Ok then i will come to ur home after half an hour,ham
2888,U horrible gal... U knew dat i was going out wif him yest n u still come n ask me...,ham
2889,WIN a £200 Shopping spree every WEEK Starting NOW. 2 play text STORE to 88039. SkilGme. TsCs08714740323 1Winawk! age16 £1.50perweeksub.,spam
2890,One day a crab was running on the sea shore..The waves came n cleared the footprints of the crab.. Crab asked: being my frnd y r u clearing my beautiful footprints? Waves replied: A fox was following ur footprints to catch you! thats y i cleared it off:) frndsship never lets u dwn :-) GUD nyt..,ham
2891,Hi.:)technical support.providing assistance to us customer through call and email:),ham
2892,Boy you best get yo ass out here quick,ham
2893,They have a thread on the wishlist section of the forums where ppl post nitro requests. Start from the last page and collect from the bottom up.,ham
2894,At home also.,ham
2895,PRIVATE! Your 2003 Account Statement for <fone no> shows 800 un-redeemed S. I. M. points. Call 08715203656 Identifier Code: 42049 Expires 26/10/04,spam
2896,"Spoke with uncle john today. He strongly feels that you need to sacrifice to keep me here. He's going to call you. When he does, i beg you to just listen. Dont make any promises or make it clear things are not easy. And i need you to please let us work things out. As long as i keep expecting help, my creativity will be stifled so pls just keep him happy, no promises on your part.",ham
2897,HI DARLIN HOW WAS WORK DID U GET INTO TROUBLE? IJUST TALKED TO YOUR MUM ALL MORNING! I HAD A REALLY GOOD TIME LAST NIGHT IM GOIN OUT SOON BUT CALL ME IF U CAN,ham
2898,No calls..messages..missed calls,ham
2899,Call FREEPHONE 0800 542 0578 now!,spam
2900,S:)no competition for him.,ham
2901,Good Morning my Dear Shijutta........... Have a great &amp; successful day.,ham
2902,Carlos'll be here in a minute if you still need to buy,ham
2903,Spoons it is then okay?,ham
2904,HIYA COMIN 2 BRISTOL 1 ST WEEK IN APRIL. LES GOT OFF + RUDI ON NEW YRS EVE BUT I WAS SNORING.THEY WERE DRUNK! U BAK AT COLLEGE YET? MY WORK SENDS INK 2 BATH.,ham
2905,And how's your husband.,ham
2906,U WILL SWITCH YOUR FONE ON DAMMIT!!,ham
2907,haha but no money leh... Later got to go for tuition... Haha and looking for empty slots for driving lessons,ham
2908,Free Top ringtone -sub to weekly ringtone-get 1st week free-send SUBPOLY to 81618-?3 per week-stop sms-08718727870,spam
2909,"Urgent! call 09066350750 from your landline. Your complimentary 4* Ibiza Holiday or 10,000 cash await collection SAE T&Cs PO BOX 434 SK3 8WP 150 ppm 18+ ",spam
2910,"Hello, my love ! How went your day ? Are you alright ? I think of you, my sweet and send a jolt to your heart to remind you ... I LOVE YOU! Can you hear it ? I screamed it across the sea for all the world to hear. Ahmad al Hallaq is loved ! and owned ! *possessive passionate kiss*",ham
2911,Great. Hope you are using your connections from mode men also cos you can never know why old friends can lead you to today,ham
2912,Haiyoh... Maybe your hamster was jealous of million,ham
2913,Every day i use to sleep after  &lt;#&gt;  so only.,ham
2914,This is all just creepy and crazy to me.,ham
2915,I don't know u and u don't know me. Send CHAT to 86688 now and let's find each other! Only 150p/Msg rcvd. HG/Suite342/2Lands/Row/W1J6HL LDN. 18 years or over.,spam
2916,I'm done oredi...,ham
2917,Call him and say you not coming today ok and tell them not to fool me like this ok,ham
2918,I want to tell you how bad I feel that basically the only times I text you lately are when I need drugs,ham
2919,U repeat e instructions again. Wat's e road name of ur house?,ham
2920,"Tunji, how's the queen? how are you doing. This is just wishing you a great day. Abiola.",ham
2921,I'm going 2 orchard now laready me reaching soon. U reaching?,ham
2922,U GOIN OUT 2NITE?,ham
2923,Wrong phone! This phone! I answer this one but assume the other is people i don't well,ham
2924,Hello madam how are you ?,ham
2925,Annoying isn't it.,ham
2926,Oh is it! Which brand?,ham
2927,R we going with the  &lt;#&gt;  bus?,ham
2928,Any chance you might have had with me evaporated as soon as you violated my privacy by stealing my phone number from your employer's paperwork. Not cool at all. Please do not contact me again or I will report you to your supervisor.,ham
2929,"My friend just got here and says he's upping his order by a few grams (he's got $ &lt;#&gt; ), when can you get here?",ham
2930,S....s...india going to draw the series after many years in south african soil..,ham
2931,A little. Meds say take once every 8 hours. It's only been 5 but pain is back. So I took another. Hope I don't die,ham
2932,Whatsup there. Dont u want to sleep,ham
2933,Hey next sun 1030 there's a basic yoga course... at bugis... We can go for that... Pilates intro next sat.... Tell me what time you r free,ham
2934,Yeah no probs - last night is obviously catching up with you... Speak soon ,ham
2935,O. Well uv causes mutations. Sunscreen is like essential thesedays,ham
2936,Thanx a lot...,ham
2937,Yeah I'll try to scrounge something up,ham
2938,There the size of elephant tablets & u shove um up ur ass!!,ham
2939,What you need. You have a person to give na.,ham
2940,You have got tallent but you are wasting.,ham
2941,Wat's my dear doing? Sleeping ah?,ham
2942,UR GOING 2 BAHAMAS! CallFREEFONE 08081560665 and speak to a live operator to claim either Bahamas cruise of£2000 CASH 18+only. To opt out txt X to 07786200117,spam
2943,K.i will send in  &lt;#&gt;  min:),ham
2944,"Do you realize that in about 40 years, we'll have thousands of old ladies running around with tattoos?",spam
2945,SORRY IM STIL FUCKED AFTER LAST NITE WENT TOBED AT 430 GOT UP 4 WORK AT 630,ham
2946,We are both fine. Thanks,ham
2947,I absolutely LOVE South Park! I only recently started watching the office.,ham
2948,Now press conference da:),ham
2949,Shant disturb u anymore... Jia you...,ham
2950,No problem. We will be spending a lot of quality time together...,ham
2951,Was just about to ask. Will keep this one. Maybe that's why you didn't get all the messages we sent you on glo,ham
2952,Even my brother is not like to speak with me. They treat me like aids patent.,ham
2953,Already am squatting is the new way of walking,ham
2954,Where are you lover ? I need you ...,ham
2955,"It'll be tough, but I'll do what I have to",ham
2956,I am taking half day leave bec i am not well,ham
2957,LOL what happens in Vegas stays in vegas,ham
2958,Also that chat was awesome but don't make it regular unless you can see her in person,ham
2959,So what u doing today?,ham
2960,Warner Village 83118 C Colin Farrell in SWAT this wkend @Warner Village & get 1 free med. Popcorn!Just show msg+ticket@kiosk.Valid 4-7/12. C t&c @kiosk. Reply SONY 4 mre film offers,spam
2961,Yes. They replied my mail. I'm going to the management office later. Plus will in to bank later also.or on wednesday.,ham
2962,"""HEY DAS COOL... IKNOW ALL 2 WELLDA PERIL OF STUDENTFINANCIAL CRISIS!SPK 2 U L8R.""",ham
2963,Yo you guys ever figure out how much we need for alcohol? Jay and I are trying to figure out how much we can safely spend on weed,ham
2964,"2 celebrate my bday, y else?",ham
2965,"Actually nvm, got hella cash, we still on for  &lt;#&gt; ish?",ham
2966,Aiyo a bit pai seh ü noe... Scared he dun rem who i am then die... Hee... But he become better lookin oredi leh...,ham
2967,Mind blastin.. No more Tsunamis will occur from now on.. Rajnikant stopped swimming in Indian Ocean..:-D,ham
2968,How's ur paper?,ham
2969,Congrats kano..whr s the treat maga?,ham
2970,And by when you're done I mean now,ham
2971,Sent me de webadres for geting salary slip,ham
2972,Okie,ham
2973,Boooo you always work. Just quit.,ham
2974,Wat so late still early mah. Or we juz go 4 dinner lor. Aiya i dunno...,ham
2975,"Sir, Waiting for your mail.",ham
2976,Jay's getting really impatient and belligerent,ham
2977,lyricalladie(21/F) is inviting you to be her friend. Reply YES-910 or NO-910. See her: www.SMS.ac/u/hmmross STOP? Send STOP FRND to 62468,spam
2978,"Thank You for calling.Forgot to say Happy Onam to you Sirji.I am fine here and remembered you when i met an insurance person.Meet You in Qatar Insha Allah.Rakhesh, ex Tata AIG who joined TISSCO,Tayseer.",ham
2979,*deep sigh* ... I miss you :-( ... I am really surprised you haven't gone to the net cafe yet to get to me ... Don't you miss me?,ham
2980,Tell them no need to investigate about me anywhere.,ham
2981,"Carlos took a while (again), we leave in a minute",ham
2982,"I know dat feelin had it with Pete! Wuld get with em , nuther place nuther time mayb?",ham
2983,What i told before i tell. Stupid hear after i wont tell anything to you. You dad called to my brother and spoken. Not with me.,ham
2984,If i not meeting ü all rite then i'll go home lor. If ü dun feel like comin it's ok.,ham
2985,I'm reaching home in 5 min.,ham
2986,Wife.how she knew the time of murder exactly,ham
2987,No no:)this is kallis home ground.amla home town is durban:),ham
2988,"Welcome to UK-mobile-date this msg is FREE giving you free calling to 08719839835. Future mgs billed at 150p daily. To cancel send ""go stop"" to 89123",spam
2989,"sry can't talk on phone, with parents",ham
2990,Thanks for your message. I really appreciate your sacrifice. I'm not sure of the process of direct pay but will find out on my way back from the test tomorrow. I'm in class now. Do have a wonderful day.,ham
2991,"Argh my 3g is spotty, anyway the only thing I remember from the research we did was that province and sterling were the only problem-free places we looked at",ham
2992,Sent me ur email id soon,ham
2993,it to 80488. Your 500 free text messages are valid until 31 December 2005.,spam
2994,Can come my room but cannot come my house cos my house still messy... Haha...,ham
2995,Mystery solved! Just opened my email and he's sent me another batch! Isn't he a sweetie,ham
2996,Yo you around? A friend of mine's lookin to pick up later tonight,ham
2997,Email AlertFrom: Jeri StewartSize: 2KBSubject: Low-cost prescripiton drvgsTo listen to email call 123,spam
2998,Staff of placement training in Amrita college.,ham
2999,Well i will watch shrek in 3D!!B),ham
3000,Oh...i asked for fun. Haha...take care. ü,ham
3001,Well I'm going to be an aunty!,ham
3002,"Just looked it up and addie goes back Monday, sucks to be her",ham
3003,"Haha awesome, omw back now then",ham
3004,I wish u were here. I feel so alone,ham
3005,Yep then is fine 7.30 or 8.30 for ice age.,ham
3006,"Ok omw now, you at castor?",ham
3007,Some of them told accenture is not confirm. Is it true.,ham
3008,"As a valued customer, I am pleased to advise you that following recent review of your Mob No. you are awarded with a £1500 Bonus Prize, call 09066368470",spam
3009,I'll be at mu in like  &lt;#&gt;  seconds,ham
3010,Ok. No wahala. Just remember that a friend in need ...,ham
3011,"I get out of class in bsn in like  &lt;#&gt;  minutes, you know where advising is?",ham
3012,"Anyway I don't think I can secure anything up here, lemme know if you want me to drive down south and chill",ham
3013,Lol your right. What diet? Everyday I cheat anyway. I'm meant to be a fatty :(,ham
3014,Den wat will e schedule b lk on sun?,ham
3015,Quite late lar... Ard 12 anyway i wun b drivin...,ham
3016,Glad to see your reply.,ham
3017,"I didnt get ur full msg..sometext is missing, send it again",ham
3018,Lmao ok I wont be needing u to do my hair anymore.,ham
3019,Did u receive my msg?,ham
3020,I am not sure about night menu. . . I know only about noon menu,ham
3021,We have to pick rayan macleran there.,ham
3022,She just broke down a list of reasons why nobody's in town and I can't tell if she's being sarcastic or just faggy,ham
3023,R u over scratching it?,ham
3024,So that takes away some money worries,ham
3025,I REALLY NEED 2 KISS U I MISS U MY BABY FROM UR BABY 4EVA,ham
3026,"No idea, I guess we'll work that out an hour after we're supposed to leave since as usual nobody has any interest in figuring shit out before the last second",ham
3027,"Text82228>> Get more ringtones, logos and games from www.txt82228.com. Questions: info@txt82228.co.uk",spam
3028,"Hello, yeah i've just got out of the bath and need to do my hair so i'll come up when i'm done, yeah?",ham
3029,Oh great. I.ll disturb him more so that we can talk.,ham
3030,"House-Maid is the murderer, coz the man was murdered on  &lt;#&gt; th January.. As public holiday all govt.instituitions are closed,including post office..understand?",ham
3031,If i start sending blackberry torch to nigeria will you find buyer for me?like 4a month. And tell dad not to buy bb from anyone oh.,ham
3032,"Waqt se pehle or naseeb se zyada kisi ko kuch nahi milta,Zindgi wo nahi he jo hum sochte hai Zindgi wo hai jo ham jeetey hai..........",ham
3033,Well. Balls. Time to make calls,ham
3034,I just saw ron burgundy captaining a party boat so yeah,ham
3035,I am waiting machan. Call me once you free.,ham
3036,I had it already..sabarish asked me to go..,ham
3037,I know that my friend already told that.,ham
3038,"Sun cant come to earth but send luv as rays. cloud cant come to river but send luv as rain. I cant come to meet U, but can send my care as msg to U. Gud evng",ham
3039,"TODAY is Sorry day.! If ever i was angry with you, if ever i misbehaved or hurt you? plz plz JUST SLAP URSELF Bcoz, Its ur fault, I'm basically GOOD",ham
3040,I will spoil you in bed as well :),ham
3041,Yes :)it completely in out of form:)clark also utter waste.,ham
3042,"Sorry man, my stash ran dry last night and I can't pick up more until sunday",ham
3043,"SMS. ac Blind Date 4U!: Rodds1 is 21/m from Aberdeen, United Kingdom. Check Him out http://img. sms. ac/W/icmb3cktz8r7!-4 no Blind Dates send HIDE",spam
3044,"YOU VE WON! Your 4* Costa Del Sol Holiday or £5000 await collection. Call 09050090044 Now toClaim. SAE, TC s, POBox334, Stockport, SK38xh, Cost£1.50/pm, Max10mins",spam
3045,How was txting and driving,ham
3046,Thts god's gift for birds as humans hav some natural gift frm god..,ham
3047,When i have stuff to sell i.ll tell you,ham
3048,"G says you never answer your texts, confirm/deny",ham
3049,I love ya too but try and budget your money better babe. Gary would freak on me if he knew,ham
3050,You have 1 new voicemail. Please call 08719181513.,spam
3051,"Come to me, slave. Your doing it again ... Going into your shell and unconsciously avoiding me ... You are making me unhappy :-(",ham
3052,She went to attend another two rounds today..but still did't reach home..,ham
3053,"The affidavit says  &lt;#&gt;  E Twiggs St, division g, courtroom  &lt;#&gt; , &lt;TIME&gt;  AM. I'll double check and text you again tomorrow",ham
3054,important information 4 orange user . today is your lucky day!2find out why log onto http://www.urawinner.com THERE'S A FANTASTIC SURPRISE AWAITING YOU!,spam
3055,"He said that he had a right giggle when he saw u again! You would possibly be the first person2die from NVQ, but think how much you could for! ",ham
3056,Do I? I thought I put it back in the box,ham
3057,You won't believe it but it's true. It's Incredible Txts! Reply G now to learn truly amazing things that will blow your mind. From O2FWD only 18p/txt,spam
3058,"Same here, but I consider walls and bunkers and shit important just because I never play on peaceful but I guess your place is high enough that it don't matter",ham
3059,Nope but i'm going home now then go pump petrol lor... Like going 2 rain soon...,ham
3060,"Oh... Icic... K lor, den meet other day...",ham
3061,That is wondarfull song,ham
3062,Oh just getting even with u.... u?,ham
3063,GENT! We are trying to contact you. Last weekends draw shows that you won a £1000 prize GUARANTEED. Call 09064012160. Claim Code K52. Valid 12hrs only. 150ppm ,spam
3064,Moji i love you more than words. Have a rich day,ham
3065,Am i that much bad to avoid like this?,ham
3066,At 7 we will go ok na.,ham
3067,Good sleep is about rhythm. The person has to establish a rhythm that the body will learn and use. If you want to know more :-),ham
3068,I want  &lt;#&gt;  rs da:)do you have it?,ham
3069,Then any special there?,ham
3070,Sitting in mu waiting for everyone to get out of my suite so I can take a shower,ham
3071,No. To be nosy I guess. Idk am I over reacting if I'm freaked?,ham
3072,Are there TA jobs available? Let me know please cos i really need to start working,ham
3073,2marrow only. Wed at  &lt;#&gt;  to 2 aha.,ham
3074,What I'm saying is if you haven't explicitly told nora I know someone I'm probably just not gonna bother,ham
3075,I am in your office na.,ham
3076,"all the lastest from Stereophonics, Marley, Dizzee Racal, Libertines and The Strokes! Win Nookii games with Flirt!! Click TheMob WAP Bookmark or text WAP to 82468",spam
3077,PLEASSSSSSSEEEEEE TEL ME V AVENT DONE SPORTSx,ham
3078,"Good afternoon sexy buns! How goes the job search ? I wake and you are my first thought as always, my love. I wish your fine and happy and know I adore you!",ham
3079,Tomorrow i am not going to theatre. . . So i can come wherever u call me. . . Tell me where and when to come tomorrow,ham
3080,I thk u dun haf 2 hint in e forum already lor... Cos i told ron n darren is going 2 tell shuhui.,ham
3081,"Text me when you get off, don't call, my phones having problems",ham
3082,"Wat time liao, where still got.",ham
3083,That means from february to april i'll be getting a place to stay down there so i don't have to hustle back and forth during audition season as i have since my sister moved away from harlem.,ham
3084,If You mean the website. Yes.,ham
3085,"Just got some gas money, any chance you and the gang want to go on a grand nature adventure?",ham
3086,Gr8 new service - live sex video chat on your mob - see the sexiest dirtiest girls live on ur phone - 4 details text horny to 89070 to cancel send STOP to 89070,spam
3087,No she didnt. I will search online and let you know.,ham
3088,"WIN: We have a winner! Mr. T. Foley won an iPod! More exciting prizes soon, so keep an eye on ur mobile or visit www.win-82050.co.uk",spam
3089,Pandy joined 4w technologies today.he got job..,ham
3090,No message..no responce..what happend?,ham
3091,"Aight I've been set free, think you could text me blake's address? It occurs to me I'm not quite as sure what I'm doing as I thought I was",ham
3092,Did you get any gift? This year i didnt get anything. So bad,ham
3093,Still chance there. If you search hard you will get it..let have a try :),ham
3094,Yar lor... How u noe? U used dat route too?,ham
3095,"Just gettin a bit arty with my collages at the mo, well tryin 2 ne way! Got a roast in a min lovely i shall enjoy that!",ham
3096,How much r ü willing to pay?,ham
3097,Is avatar supposed to have subtoitles,ham
3098,Some are lasting as much as 2 hours. You might get lucky.,ham
3099,Wat time ü wan today?,ham
3100,Anything...,ham
3101,"Jus chillaxin, what up",ham
3102,Early bird! Any purchases yet?,ham
3103,Oic... I saw him too but i tot he din c me... I found a group liao...,ham
3104,"By the way, 'rencontre' is to meet again. Mountains dont....",ham
3105,I'm good. Have you registered to vote?,ham
3106,That's good. Lets thank God. Please complete the drug. Have lots of water. And have a beautiful day.,ham
3107,Leaving to qatar tonite in search of an opportunity.all went fast.pls add me in ur prayers dear.Rakhesh,ham
3108,Rightio. 11.48 it is then. Well arent we all up bright and early this morning.,ham
3109,I have to take exam with march 3,ham
3110,Haven't heard anything and he's not answering my texts so I'm guessing he flaked. That said the jb is fantastic,ham
